{
  "contract_version": "v1",
  "schedule_id": "schedule_v1_01J8Q3Z4R5T6V7W8X9Y0ABCDEF",
  "request_id": "request_v1_01J8Q3Z4R5T6V7W8X9Y0ABCDEF",
  "task_brief_ref": "task_v1_01J8Q3Z4R5T6V7W8X9Y0ABCDEF",
  "intent_ref": "intent_v1_01J8Q3Z4R5T6V7W8X9Y0ABCDEF",
  "trace_id": "trace_v1_01J8Q3Z4R5T6V7W8X9Y0ABCDEF",
  "revision": 5,
  "timezone": "Europe/Berlin",
  "clarification_required": false,
  "idempotency_key": "schedule-request-01J8Q3Z4R5T6V7W8X9Y0ABCDEF",
  "schedule": {"mode": "one_shot", "run_at": "2026-08-01T09:00:00+02:00"},
  "limits": {"max_runs": 1},
  "retry_policy": {"max_retries": 2, "retry_delay_seconds": 60},
  "budget": {
    "max_cost_minor": 500,
    "currency": "EUR",
    "quote_ref": "quote_v1_01J8Q3Z4R5T6V7W8X9Y0ABCDEF",
    "approval_ref": "approval_v1_01J8Q3Z4R5T6V7W8X9Y0ABCDEF"
  }
}
